ParentType,TypeID,ElementID,ParentTypeName,TypeName,Content,Notes
,,,,City HEAD1,AmeriSpec [Home inspection] in [City],1-Home Inspection
,,,,City INTRO1 S1,Nothing ensures and provides the confidence to close a real estate deal like a [home inspection] by an AmeriSpec in [city].,1-Home Inspection
,,,,City INTRO1 S2,AmeriSpec is the #1 Canadian  home inspection company and has been around for the past 20 years.,1-Home Inspection
,,,,City INTRO1 S3,Each and every one of our inspectors are trained to not only meet but to exceed the high Standards of practice of the Canadian Association of Home Inspectors.,1-Home Inspection
,,,,City INTRO1 S4,"To arrange an appointment for a [home inspection] in [city], enter your postal code to contact your local AmeriSpec inspector today.",1-Home Inspection
,,,,City CONTACT1,[phone][postal code][online form],1-Home Inspection
,,,,City CTA H1,Book your [home inspection] in [city],1-Home Inspection
,,,,City CTA B1,Enter the first three digits of your postal code for a [home inspection] in [city].,1-Home Inspection
,,,,City SUB1,[Home inspection] in [city] you can depend on,1-Home Inspection
,,,,City BODY1 S1,"Your AmeriSpec [Home Inspection] in [city] will access over 400 items including the foundation, roof, and structural components, plus visible electrical, plumbing and mechanical operating systems of the home.",1-Home Inspection
,,,,City BODY1 S2,All of our inspectors have been trained to execute a [home inspection] in [city] that meets the highest standards in the industry and exceeds the standards set by the Canadian Association of Home and Property Inspectors (CAPHI).,1-Home Inspection
,,,,City BULLET H1,"A [Home Inspection] in [City] by AmeriSpec provides the following benefits, including:",1-Home Inspection
,,,,City BULLET1,Less Buyer DiscomfortReduced Buyer RemorseLess NegotiationReduced Listing TimeContact AmeriSpec to learn more,1-Home Inspection
,,,,City SUB2,The AmeriSpec [Home inspection] in [City],1-Home Inspection
,,,,City BODY2 S1,You can be sure and confident about using an AmeriSpec inspector to perform your [home inspection] in [city].,1-Home Inspection
,,,,City BODY2 S2,Our highly-experienced team of certified inspectors have examined more homes than any other home inspection company in North America and continue to set the  standards for the home inspection industry.,1-Home Inspection
,,,,City BODY2 S3,"The home inspection findings will be packaged in an, easy-to-reference binder and features a detailed evaluation of the home, a Home Repair Manual, a Seasonal Maintenance Checklist, and our Home Owner Rewards Program which provides a wide range of discounts offered by our partners.",1-Home Inspection
,,,,City LINK FEATURE1,"Did you know that our inspectors also perform Home Energy Audits in [City]? Learn more, now",1-Home Inspection
,,,,City FOOT1,"Have a stress-free and successful closing. Contact your local AmeriSpec to get a [home inspection] in [city], now.Learn how you can earn 500 Aeroplan速 Miles with a [home inspection] in [city] from AmeriSpec!",1-Home Inspection
,,,,City DOWNLOAD H1,The AmeriSpec InfoCentre,1-Home Inspection
,,,,City DOWNLOAD B1,Download our brochures for more detailed information about the [home inspection] in [city].,1-Home Inspection
,,,,City HEAD1,AmeriSpec [Home inspection] in [City],2-Home Inspection
,,,,City INTRO1 S1,Nothing gives the confidence to close a real estate deal like a [home inspection] by  AmeriSpec in [city].,2-Home Inspection
,,,,City INTRO1 S2,AmeriSpec is the leading Canadian home inspection company in the country and has been around for the past 20 years.,2-Home Inspection
,,,,City INTRO1 S3,All of our inspectors are qualified to not only meet but to exceed the high Standards of practice of the Canadian Association of Home Inspectors.,2-Home Inspection
,,,,City INTRO1 S4,"To make an appointment for a [home inspection] in [city], enter your postal code to contact your local AmeriSpec inspector today.",2-Home Inspection
,,,,City CONTACT1,[phone][postal code][online form],2-Home Inspection
,,,,City CTA H1,Book your [home inspection] in [city],2-Home Inspection
,,,,City CTA B1,Enter the first three digits of your postal code for a [home inspection] in [city].,2-Home Inspection
,,,,City SUB1,[Home inspection] in [city] you can rely on,2-Home Inspection
,,,,City BODY1 S1,"Your AmeriSpec [Home Inspection] in [city] will review over 400 areas of the property including the foundation, roof, and structural components, plus visible electrical, plumbing and mechanical operating systems.",2-Home Inspection
,,,,City BODY1 S2,All of our inspectors are highly educated and have been trained to carry out a [home inspection] in [city] that meets the highest standards in the industry and exceeds the standards set by the Canadian Association of Home and Property Inspectors (CAPHI).,2-Home Inspection
,,,,City BULLET H1,"A [Home Inspection] in [City] performed by AmeriSpec provides the following benefits, including:",2-Home Inspection
,,,,City BULLET1,Less Buyer DiscomfortReduced Buyer RemorseLess NegotiationReduced Listing TimeContact AmeriSpec to learn more,2-Home Inspection
,,,,City SUB2,The AmeriSpec [Home inspection] in [City],2-Home Inspection
,,,,City BODY2 S1,You can be certain and feel secure about using an AmeriSpec inspector to perform your [home inspection] in [city].,2-Home Inspection
,,,,City BODY2 S2,Our highly-experienced and trained team of certified inspectors have examined more homes than any other home inspection company in North America and continue to set the standards for the home inspection industry.,2-Home Inspection
,,,,City BODY2 S3,"The home inspection results will be organized in an, easy-to-reference binder and features a detailed evaluation of the home, a Home Repair Manual, a Seasonal Maintenance Checklist, and our Home Owner Rewards Program which provides a wide range of discounts offered by our partners.",2-Home Inspection
,,,,City LINK FEATURE1,"Ask about our home Energy Audits in [City]? Learn more, now",2-Home Inspection
,,,,City FOOT1,Experience a successful closing. Please feel free to contact your local AmeriSpec to get a [home inspection] in [city] n.Learn more about how you can earn 500 Aeroplan速 Miles with a [home inspection] in [city] from AmeriSpec!,2-Home Inspection
,,,,City DOWNLOAD H1,The AmeriSpec InfoCentre,2-Home Inspection
,,,,City DOWNLOAD B1,Download our brochures for more detailed information about the [home inspection] in [city].,2-Home Inspection
,,,,Province HEAD1,AmeriSpec [home inspection] in [Province] seals the deal,1-Home Inspection
,,,,Province INTRO1 S1,Nothing helps close the deal for potential homebuyers like a home inspection] in [Province] by [AmeriSpec].,1-Home Inspection
,,,,Province INTRO1 S2,"Despite how perfect a home may seem to be on the surface or how emotionally attached the homebuyer is, there is always a sense of doubt.",1-Home Inspection
,,,,Province INTRO1 S3,That&rsquo;s when an AmeriSpec [home inspection] in [Province] can make the difference.,1-Home Inspection
,,,,Province INTRO1 S4,A trustworthy and detailed [Home inspection] in [Province] can provide homebuyers with the peace of mind and confidence they deserve when making such as large and rare purchase.,1-Home Inspection
,,,,Province CONTACT1,[phone][postal code][online form],1-Home Inspection
,,,,Province CTA H1,Schedule your [home inspection] in [Province] today,1-Home Inspection
,,,,Province CTA B1,"For local information about our [home inspection] in [province], choose your city from the list.",1-Home Inspection
,,,,Province SUB1,Why get a [Home Inspection] in [Province]?,1-Home Inspection
,,,,Province BODY1 S1,More real estate professionals are suggesting home buyers to invest in a [home inspection] in [province] before they make a final purchase.,1-Home Inspection
,,,,Province BODY1 S2,"The reason is simple: a [home inspection] helps  buyers learn more about the property up front, which facilitates a quicker and confident purchasing decision.A [Home inspection] in [province] gives sellers, especially those who have had a prelisting inspection, the benefit of  a quicker sale with less surprises as closing nears.",1-Home Inspection
,,,,Province BODY1 S3,"In addition, the real estate agent, closing attorney, finance and insurance professionals benefit from a [home inspection] in [province] through efficient transactions that provide simple closings and happier homebuyers.",1-Home Inspection
,,,,Province LINK FEATURE1,"You probably didn&rsquo;t know  that we also provide Home Energy Audits in [Province]? Learn more, today",1-Home Inspection
,,,,Province FOOT1,"A [Home inspection] in [Province] translates into a positive purchase experience for homebuyers, sellers and everyone else involved. If you are ready to learn more about what AmeriSpec can do for you, choose your city from the list to receive detailed information about a [home inspection] in [Province].Plus, earn 500 Aeroplan速 Miles with a [home inspection] in [Province] from AmeriSpec!",1-Home Inspection
,,,,Province DOWNLOAD H1,The AmeriSpec InfoCentre,1-Home Inspection
,,,,Province DOWNLOAD B1,Download our brochures for more detailed information about [home inspection] in [province].,1-Home Inspection
,,,,Province HEAD1,An AmeriSpec [home inspection] in [Province] seals the deal,2-Home Inspection
,,,,Province INTRO1 S1,Nothing can help close the deal for potential homebuyers like an [AmeriSpec] [home inspection] in [Province].,2-Home Inspection
,,,,Province INTRO1 S2,"Despite how perfect a home may look on the surface or how emotionally attached the homebuyer is, there is always a sense of uncertainty.",2-Home Inspection
,,,,Province INTRO1 S3,That&rsquo;s where an AmeriSpec [home inspection] in [Province] can help make a difference.,2-Home Inspection
,,,,Province INTRO1 S4,A reliable and meticulous [Home inspection] in [Province] can provide homebuyers with the peace of mind and assurance they deserve when Purchasing a property.,2-Home Inspection
,,,,Province CONTACT1,[phone][postal code][online form],2-Home Inspection
,,,,Province CTA H1,Schedule a [home inspection] in [Province] now,2-Home Inspection
,,,,Province CTA B1,"For local information and details about our [home inspection] in [province], choose your city from the list.",2-Home Inspection
,,,,Province SUB1,Get the certainty you deserve: A [Home Inspection] in [Province],2-Home Inspection
,,,,Province BODY1 S1,More real estate agents and brokers are suggesting home buyers to invest in a [home inspection] in [province] before they make a final purchase.,2-Home Inspection
,,,,Province BODY1 S2,"The reason is obvious: a [home inspection] helps buyers learn more about the property up front, which facilitates a faster and smooth purchase.A [Home inspection] in [province] provides sellers, especially those who have had a prelisting inspection, with the benefit of a faster sale with less surprises as closing nears.",2-Home Inspection
,,,,Province BODY1 S3,"The real estate agent, closing attorney, finance and insurance professionals alsobenefit from a [home inspection] in [province] through efficient transactions that provide simple closings and satisfied homebuyers.",2-Home Inspection
,,,,Province LINK FEATURE1,"You probably didn&rsquo;t know but we also conduct Home Energy Audits in [Province]? Learn more, today",2-Home Inspection
,,,,Province FOOT1,"A [Home inspection] in [Province] helps create a positive purchase experience for homebuyers, sellers and everyone else involved in the purchase or sale of a property. If you want to learn more about how AmeriSpec can help, choose your city from the list to receive detailed information about a [home inspection] in [Province].Plus, earn 500 Aeroplan速 Miles with a [home inspection] in [Province] from AmeriSpec!",2-Home Inspection
,,,,Province DOWNLOAD H1,The AmeriSpec InfoCentre,2-Home Inspection
,,,,Province DOWNLOAD B1,Download our brochures for more detailed information about [home inspection] in [province].,2-Home Inspection
